id,name,status,skill_level,stickhandling_bucket,tags,puck_location,hand_speed,feeds_into,default_duration_sec,intensity,age_min,age_max,equipment,space,step_by_step,coaching_cues,coach_preference,inspired_by,video_url,session_type
SH_001,Stationary Forehand-Backhand,active,beginner,stationary_control,"in_tight, controlled_hands, forehand_backhand, puck_control",in_tight,controlled,shooting,45,low,6,99,Stick & puck,4x4 ft,Move puck forehand to backhand in front of body,"Soft hands, relaxed grip, head up",1,self,,movement
SH_002,Wide Reach Stickhandling,active,beginner,wide_reach,"wide_reach, puck_control, extension",extended,controlled,puck_protection,45,low,6,99,Stick & puck,4x4 ft,Reach puck wide forehand and backhand,"Extend arms, control puck, head up",2,self,,movement
SH_003,Figure 8 Around Feet,active,beginner,stationary_control,"in_tight, forehand_backhand, coordination",in_tight,controlled,shooting,60,low,6,99,Stick & puck,4x4 ft,Move puck in figure 8 around feet,Head up if possible,2,self,,movement
SH_004,Single-Leg Stickhandling,active,intermediate,stationary_control,"balance, in_tight, puck_control",in_tight,controlled,puck_protection,45,low-med,8,99,Stick & puck,4x4 ft,Stickhandle while balancing on one leg,"Stable posture, head up",2,self,,movement
SH_005,Front Pull Push,active,beginner,pull_push,"pull_push, forehand_backhand, puck_control",in_tight,controlled,shooting,45,low,6,99,Stick & puck,4x4 ft,"Pull puck in, push it out repeatedly","Use wrists not arms, head up",1,self,,movement
SH_006,Backhand Only Control,active,beginner,stationary_control,"backhand_emphasis, in_tight, puck_control",in_tight,controlled,shooting,45,low,6,99,Stick & puck,4x4 ft,Stickhandle on backhand side of body,"Comfort on backhand, head up",2,self,,movement
SH_007,Wide Pull Push,active,intermediate,wide_reach,"wide_reach, pull_push, extension",extended,controlled,puck_protection,45,low-med,8,99,Stick & puck,4x4 ft,Pull puck wide then push across body,Full extension,2,self,,movement
SH_008,Quick Touch Triangle,active,intermediate,quick_hands,"quick_hands, in_tight, coordination",in_tight,fast,shooting,45,low-med,8,99,Stick & puck,4x4 ft,Move puck in triangle pattern,Quick but controlled,2,self,,movement
SH_009,Toe Drag Hold,active,intermediate,toe_drags,"toe_drags, deception, puck_control",in_tight,controlled,puck_protection,45,low-med,8,99,Stick & puck,4x4 ft,Toe drag puck and hold position,Control the drag,2,self,,movement
SH_010,Pull-Push Shuffle,active,intermediate,movement_based,"pull_push, lateral, skating_transfer",mid_range,controlled,skating,60,low-med,8,99,Stick & puck,6x6 ft,Shuffle laterally while pull-pushing puck,Feet and hands together,2,self,,movement
SH_011,Side-to-Side Reach,active,intermediate,wide_reach,"wide_reach, lateral, puck_control",extended,controlled,puck_protection,45,low-med,8,99,Stick & puck,4x4 ft,Reach puck side to side at full width,Stay balanced,2,self,,movement
SH_012,Quick Hands In Place,active,intermediate,quick_hands,"quick_hands, in_tight, hand_speed",in_tight,fast,shooting,30,low-med,8,99,Stick & puck,4x4 ft,Rapid small touches in front of body,Relax wrists,2,self,,movement
SH_013,Pull-Behind Feet,active,intermediate,pull_push,"deception, pull_push, behind_body",in_tight,controlled,puck_protection,60,low-med,10,99,Stick & puck,4x4 ft,Pull puck behind feet side to side,Control behind body,2,self,,movement
SH_014,Stationary Toe Drags,active,intermediate,toe_drags,"toe_drags, deception, puck_control",in_tight,controlled,shooting,45,low-med,10,99,Stick & puck,4x4 ft,Repeated toe drags side to side,Sell the fake,2,self,,movement
SH_015,Forward Walk Stickhandle,active,intermediate,movement_based,"in_stride, coordination, skating_transfer",mid_range,controlled,skating,60,low-med,8,99,Stick & puck,10 ft lane,Walk forward while stickhandling,Head up,1,self,,movement
SH_016,Backward Walk Stickhandle,active,intermediate,movement_based,"in_stride, coordination, skating_transfer",mid_range,controlled,skating,60,low-med,8,99,Stick & puck,10 ft lane,Walk backward while controlling puck,Soft hands,2,self,,movement
SH_017,Reaction Call Stickhandle,active,intermediate,reaction,"reaction, decision_making, puck_control",in_tight,fast,decision_making,45,low-med,8,99,Stick & puck,4x4 ft,Change direction on verbal cue,React not rush,2,self,,movement
SH_018,Lateral Shuffle Stickhandle,active,advanced,movement_based,"lateral, skating_transfer, coordination",mid_range,controlled,skating,60,low-med,10,99,Stick & puck,10 ft lane,Lateral shuffle while stickhandling,Stay low,1,self,,movement
SH_019,Toe Drag Pull Push Combo,active,advanced,toe_drags,"toe_drags, pull_push, deception",in_tight,controlled,shooting,60,low-med,10,99,Stick & puck,4x4 ft,Toe drag then pull-push across body,Smooth combo,1,self,,movement
SH_020,Quick Hands Wide Narrow,active,advanced,quick_hands,"quick_hands, change_of_width, deception",in_tight,fast,shooting,45,low-med,10,99,Stick & puck,4x4 ft,Alternate wide and narrow touches,Change pace,2,self,,movement
SH_022,Lateral Cross Step Handle,active,advanced,movement_based,"lateral, crossover, skating_transfer",mid_range,controlled,skating,60,low-med,10,99,Stick & puck,10 ft lane,Crossover steps while stickhandling,Feet lead hands,2,self,,movement
SH_024,Stickhandle Two Objects,active,advanced,reaction,"dual_object, coordination, puck_control",in_tight,fast,decision_making,45,low-med,12,99,Stickhandling ball,4x4 ft,Stick handle two balls/pucks and control each independently,Soft hands,2,self,,movement
SH_025,Toe Drag to Wide Push,active,advanced,toe_drags,"toe_drags, wide_reach, deception",extended,explosive,shooting,45,low-med,12,99,Stick & puck,4x4 ft,Toe drag then push puck wide explosively,Sell deception,1,self,,movement
SH_026,Continuous Figure 8,active,advanced,stationary_control,"in_tight, forehand_backhand, coordination",in_tight,fast,shooting,60,low-med,10,99,Stick & puck,4x4 ft,Continuous figure 8 at higher speed,Control speed,2,self,,movement
SH_028,Forward-Backward Walk Handle,active,advanced,movement_based,"in_stride, coordination, skating_transfer",mid_range,controlled,skating,60,low-med,10,99,Stick & puck,10 ft lane,Walk forward then backward while handling,Smooth transitions,2,self,,movement
SH_029,Wide Reach Toe Drags,active,advanced,toe_drags,"wide_reach, toe_drags, puck_control",extended,controlled,puck_protection,60,low-med,12,99,Stick & puck,4x4 ft,Wide reach toe drags side to side,Max reach control,2,self,,movement
SH_031,Around the World Stickhandling,active,intermediate,stationary_control,"full_body, in_tight, coordination",in_tight,controlled,shooting,60,low-med,8,99,Stick & puck,4x4 ft,Move puck around entire body starting forehand and returning to forehand,Smooth transitions around body,2,self,,movement
SH_032,Backhand Toe Drag Control,active,advanced,toe_drags,"backhand_emphasis, toe_drags, deception",in_tight,controlled,shooting,45,low-med,10,99,Stick & puck,4x4 ft,Perform repeated backhand toe drags maintaining control,Strong backhand blade control,1,self,,movement
SH_033,Pull Through Legs Kick to Forehand,active,advanced,pull_push,"through_legs, deception, forehand_finish",in_tight,controlled,shooting,45,low-med,10,99,Stick & puck,4x4 ft,Pull puck through legs and kick it out to forehand,Sell deception,1,self,,movement
SH_034,Pull Through Legs Kick to Backhand,active,advanced,pull_push,"through_legs, deception, backhand_finish",in_tight,controlled,shooting,45,low-med,10,99,Stick & puck,4x4 ft,Pull puck through legs and kick it out to backhand,"Quick feet, soft hands",1,self,,movement
SH_035,Pull Through Legs Straight to Forehand,active,advanced,pull_push,"through_legs, forehand_finish, puck_control",in_tight,controlled,shooting,45,low-med,10,99,Stick & puck,4x4 ft,Pull puck through legs directly to forehand,Protect puck through middle,2,self,,movement
SH_036,Pull Through Legs Straight to Backhand,active,advanced,pull_push,"through_legs, backhand_finish, puck_control",in_tight,controlled,shooting,45,low-med,10,99,Stick & puck,4x4 ft,Pull puck through legs directly to backhand,Backhand control,2,self,,movement
SH_037,Toe Drag into Puck Protection,active,advanced,toe_drags,"toe_drags, puck_protection, body_positioning",in_tight,controlled,puck_protection,60,low-med,12,99,Stick & puck,4x4 ft,Toe drag puck then shift body to protect it,Use body between puck and defender,1,self,,movement
SH_038,Wide Backhand Protection Control,active,advanced,wide_reach,"backhand_emphasis, wide_reach, puck_protection",extended,controlled,puck_protection,60,low-med,12,99,Stick & puck,4x4 ft,Move puck wide across body into backhand protection,Strong edges stance,1,self,,movement
SH_039,Deceptive Fake Pass Combo,active,advanced,reaction,"deception, fake_pass, decision_making",in_tight,fast,decision_making,60,low-med,12,99,Stick & puck,4x4 ft,"Fake pass, quick stickhandles, second deceptive fake",Sell fakes with eyes,1,self,,movement
SH_040,"Single-Leg Stickhandling ""Around the World""",active,intermediate,stationary_control,"balance, in_tight, full_body",in_tight,controlled,puck_protection,45,low-med,8,99,Stick & puck,4x4 ft,Stickhandle around the entire body while balancing on one leg,Stable posture,2,self,,movement
SH_041,Single-Leg Hop Over Line,active,advanced,movement_based,"balance, plyometric, coordination",in_tight,controlled,skating,45,low-med,10,99,Stick & puck,4x4 ft,Hop over a line on one leg while controlling puck,Stay balanced,2,self,,movement
SH_042,Single-Leg Forward Hop Handle,active,advanced,movement_based,"balance, plyometric, skating_transfer",mid_range,controlled,skating,60,low-med,10,99,Stick & puck,6 ft lane,Hop forward on one leg while stickhandling,Soft landings,2,self,,movement
SH_043,Single-Leg Backward Hop Handle,active,advanced,movement_based,"balance, plyometric, skating_transfer",mid_range,controlled,skating,60,low-med,10,99,Stick & puck,6 ft lane,Hop backward on one leg while controlling puck,Control center of mass,2,self,,movement
SH_044,Iron Cross Movement Handle,active,advanced,movement_based,"lateral, crossover, skating_transfer",mid_range,controlled,skating,90,low-med,12,99,Stick & puck,10 ft grid,Move forward/backward and laterally in cross pattern while handling,Stay controlled through transitions,1,self,,movement
SH_045,Quick-Wide-Quick Handle Series,active,advanced,quick_hands,"quick_hands, change_of_width, deception",in_tight,fast,shooting,45,low-med,10,99,Stick & puck,4x4 ft,"Quick forehand touches, one wide move, quick backhand touches",Change pace smoothly,1,self,,movement
SH_046,Head-Up Puck Protection Hold,active,advanced,stationary_control,"puck_protection, eyes_up, body_positioning",in_tight,controlled,puck_protection,45,low-med,10,99,Stick & puck,4x4 ft,Protect puck on forehand or backhand while keeping head up and scanning,"Chest tall, puck outside feet",1,self,,movement
SH_047,Head-Up Wide Reach Protection,active,advanced,wide_reach,"puck_protection, wide_reach, eyes_up",extended,controlled,puck_protection,60,low-med,12,99,Stick & puck,4x4 ft,Move puck wide across body while maintaining protection and eyes up,"See space, feel puck",1,self,,movement
SH_048,Protection with Visual Callouts,active,advanced,reaction,"puck_protection, reaction, decision_making",in_tight,fast,decision_making,45,low-med,12,99,Stick & puck,4x4 ft,Protect puck while responding to visual or verbal cues,Head stays up entire rep,1,self,,movement
SH_051,Protection with Shoulder Checks,active,advanced,reaction,"puck_protection, scanning, decision_making",in_tight,fast,decision_making,60,low-med,12,99,Stick & puck,4x4 ft,Protect puck while performing quick shoulder checks,Scan without losing control,1,self,,movement
